{
  "$ref": "#/definitions/banners",
  "definitions": {
    "banners": {
      "type": "object",
      "properties": {
        "id": {
          "type": "string"
        },
        "title": {
          "type": "string"
        },
        "highlightText": {
          "type": "string"
        },
        "description": {
          "type": "string"
        },
        "backgroundImage": {
          "type": "string"
        },
        "ctaPrimaryText": {
          "type": "string"
        },
        "ctaPrimaryLink": {
          "type": "string"
        },
        "ctaSecondaryText": {
          "type": "string"
        },
        "ctaSecondaryLink": {
          "type": "string"
        },
        "isActive": {
          "type": "boolean",
          "default": true
        },
        "order": {
          "type": "number",
          "default": 0
        },
        "$schema": {
          "type": "string"
        }
      },
      "required": [
        "id",
        "title",
        "description",
        "backgroundImage",
        "ctaPrimaryText",
        "ctaPrimaryLink",
        "ctaSecondaryText",
        "ctaSecondaryLink"
      ],
      "additionalProperties": false
    }
  },
  "$schema": "http://json-schema.org/draft-07/schema#"
}