{
  "id": "banner-service",
  "title": "Chuyên Cung Cấp",
  "highlightText": "Xe Tải, Cẩu, Mooc & Đầu Kéo Chính Hãng",
  "description": "Đa dạng sản phẩm từ xe tải nhẹ 500kg đến đầu kéo 40 tấn, với nhiều thương hiệu uy tín. Cam kết giá tốt nhất thị trường.",
  "backgroundImage": "https://tongkhoxetai.vn/upload/images/banner-xe-tai.jpg",
  "ctaPrimaryText": "Xem danh mục xe",
  "ctaPrimaryLink": "/danh-muc-xe",
  "ctaSecondaryText": "Liên hệ tư vấn",
  "ctaSecondaryLink": "/lien-he",
  "isActive": true,
  "order": 3
}
